{
  "id": "01jrcasebox0000000000000f1",
  "tenant_id": "tenant-local-v1",
  "actor_user_id": "local-user",
  "matter_id": "01jrcasebox0000000000000m1",
  "statement_text": "The parties signed the engagement letter on 2026-01-15.",
  "status": "candidate",
  "source_type": "lawyer_authored",
  "source_document_id": null,
  "source_page_number": null,
  "source_excerpt": null,
  "source_ocr_job_id": null,
  "extractor_name": null,
  "extractor_version": null,
  "extraction_confidence": null,
  "reviewer_actor_user_id": null,
  "reviewed_at": null,
  "accepted_at": null,
  "rejected_at": null,
  "rejection_reason": null,
  "supersedes_fact_id": null,
  "created_at": "2026-05-20T11:00:00.000Z"
}
