{
  "id": "01jrcasebox0000000000000f2",
  "tenant_id": "tenant-local-v1",
  "actor_user_id": "local-user",
  "matter_id": "01jrcasebox0000000000000m1",
  "statement_text": "Counterparty acknowledged receipt of the demand letter in paragraph 3.",
  "status": "candidate",
  "source_type": "llm_extraction",
  "source_document_id": "01jrcasebox0000000000000d1",
  "source_page_number": 1,
  "source_excerpt": "Counterparty acknowledges receipt of the demand letter dated 2026-01-20.",
  "source_ocr_job_id": "01jrk8m4q4xv2v8d4d4ymf5xnk",
  "extractor_name": "claude-opus-4-7",
  "extractor_version": "2026-05-01",
  "extraction_confidence": 0.92,
  "reviewer_actor_user_id": null,
  "reviewed_at": null,
  "accepted_at": null,
  "rejected_at": null,
  "rejection_reason": null,
  "supersedes_fact_id": null,
  "created_at": "2026-05-20T11:05:00.000Z"
}
