{
  "id": "01jrcasebox0000000000000f3",
  "tenant_id": "tenant-local-v1",
  "actor_user_id": "local-user",
  "matter_id": "01jrcasebox0000000000000m1",
  "statement_text": "The contract requires 30 days written notice before termination.",
  "status": "candidate",
  "source_type": "ocr_excerpt",
  "source_document_id": "01jrcasebox0000000000000d2",
  "source_page_number": 4,
  "source_excerpt": "Either party may terminate this Agreement upon thirty (30) days prior written notice to the other party.",
  "source_ocr_job_id": "01jrk8m4q4xv2v8d4d4ymf5xnl",
  "extractor_name": null,
  "extractor_version": null,
  "extraction_confidence": null,
  "reviewer_actor_user_id": null,
  "reviewed_at": null,
  "accepted_at": null,
  "rejected_at": null,
  "rejection_reason": null,
  "supersedes_fact_id": null,
  "created_at": "2026-05-20T11:10:00.000Z"
}
