{
  "id": "01jrcasebox0000000000000f5",
  "tenant_id": "tenant-local-v1",
  "actor_user_id": "local-user",
  "matter_id": "01jrcasebox0000000000000m1",
  "statement_text": "The retainer agreement was executed on 2026-01-15.",
  "status": "accepted",
  "source_type": "lawyer_authored",
  "source_document_id": null,
  "source_page_number": null,
  "source_excerpt": null,
  "source_ocr_job_id": null,
  "extractor_name": null,
  "extractor_version": null,
  "extraction_confidence": null,
  "reviewer_actor_user_id": "local-user",
  "reviewed_at": "2026-05-20T11:20:00.000Z",
  "accepted_at": "2026-05-20T11:20:30.000Z",
  "rejected_at": null,
  "rejection_reason": null,
  "supersedes_fact_id": null,
  "created_at": "2026-05-20T11:15:00.000Z"
}
